{
  "schema_version": 1,
  "events": [
    {
      "draft": {
        "title": "Parent teacher conference",
        "start": "2026-10-14T18:00:00-07:00",
        "end": "2026-10-14T18:30:00-07:00",
        "all_day": false,
        "location": null,
        "description": "Join Zoom: https://zoom.us/j/12345678901?pwd=example\\nMeeting ID: 123 4567 8901\\nPasscode: Tigers",
        "confidence": 0.99
      },
      "warnings": []
    }
  ],
  "rejected": [],
  "warnings": [],
  "provider_metadata": null
}
